{"profile":"yukh-transcript-lifecycle-completion-evidence/v0.1","completed_at":"2026-08-04T01:00:00.000Z","operation_id":"0198cf64-cc00-7000-8000-000000000001","policy_digest":"sha-256:bbbbbbbbbbbbbbbbbbbbbbbbbbbbbbbbbbbbbbbbbbbbbbbbbbbbbbbbbbbbbbbb","intent_digest":"sha-256:aaaaaaaaaaaaaaaaaaaaaaaaaaaaaaaaaaaaaaaaaaaaaaaaaaaaaaaaaaaaaaaa","security_audit_receipt":"audit:receipt:42","security_audit_checkpoint":"audit:checkpoint:9","receipts":[{"receipt_id":"0198cf64-cc00-7000-8000-000000000002","domain":"event","receipt_digest":"sha-256:c991af297b4b1d2e70111c62f8538d52f4dd785528e2db065aff31717ba5ceb4"},{"receipt_id":"0198cf64-cc00-7000-8000-000000000003","domain":"identity","receipt_digest":"sha-256:dddddddddddddddddddddddddddddddddddddddddddddddddddddddddddddddd"},{"receipt_id":"0198cf64-cc00-7000-8000-000000000004","domain":"security_audit","receipt_digest":"sha-256:eeeeeeeeeeeeeeeeeeeeeeeeeeeeeeeeeeeeeeeeeeeeeeeeeeeeeeeeeeeeeeee"}]}
